{
  "$schema": "./site.schema.json",
  "title": {
    "zh": "辰记示例博客",
    "en": "StarNote Sample Blog"
  },
  "description": {
    "zh": "用辰记写作，一键发布到自己的 GitHub Pages。这里记录写作方法、发布流程和独立博客的 SEO 心得。",
    "en": "Written in StarNote and published to my own GitHub Pages: notes on writing, publishing and SEO for independent blogs."
  },
  "about": {
    "zh": "你好，我是辰记的示例作者。这个博客由「辰记 StarNote · GitHub Pages 模板」生成：文章在辰记里写好，发布时自动提交到这个仓库，GitHub Actions 几十秒后就把它变成网站。\n\n把这段换成你自己的介绍：你是谁、写什么、读者能在这里得到什么。",
    "en": "Hi, I am the sample author of StarNote. This blog is generated by the StarNote GitHub Pages template: posts are written in StarNote, committed to this repository on publish, and GitHub Actions turns them into a website within a minute.\n\nReplace this with your own introduction: who you are, what you write about and what readers get here."
  },
  "author": {
    "name": "辰记示例作者",
    "avatar": "assets/avatar.svg"
  },
  "url": "",
  "cname": "",
  "languages": [
    "zh",
    "en"
  ],
  "theme": "auto",
  "links": [
    {
      "label": "GitHub",
      "url": "https://github.com/star-note"
    },
    {
      "label": {
        "zh": "辰记官网",
        "en": "StarNote"
      },
      "url": "https://starnote.app"
    }
  ],
  "contact": [
    {
      "label": {
        "zh": "邮箱",
        "en": "Email"
      },
      "value": "hello@example.com",
      "url": "mailto:hello@example.com"
    }
  ],
  "categories": [
    {
      "slug": "tech",
      "name": {
        "zh": "技术",
        "en": "Tech"
      }
    },
    {
      "slug": "writing",
      "name": {
        "zh": "写作",
        "en": "Writing"
      }
    }
  ],
  "starnote": {
    "handle": "demo",
    "blog_url": "https://starnote.app/@demo",
    "app_url": "https://starnote.app",
    "api_url": ""
  },
  "comments": "chenji",
  "giscus": {
    "repo": "",
    "repo_id": "",
    "category": "",
    "category_id": "",
    "mapping": "pathname"
  },
  "adsense": {
    "client": "",
    "slots": {
      "article": "",
      "end": "",
      "rail": ""
    },
    "consent": "cmp",
    "ads_txt_lines": []
  },
  "robots": {
    "ai_search": true,
    "ai_training": true,
    "disallow_md": false
  },
  "share": {
    "image": "",
    "image_width": 1200,
    "image_height": 630,
    "utm": false
  },
  "posts_per_page": 15,
  "follow_card": {
    "enabled": false
  },
  "tip_card": {
    "enabled": false
  }
}
